{
  "$schema": "https://json-schema.org/draft/2020-12/schema",
  "$id": "https://agentkit.dev/schemas/concept-toolchain/lease.schema.json",
  "title": "LEASE.json \u2014 writer lease of an incubation run (FK-78 section 78.4)",
  "type": "object",
  "required": [
    "schema_version",
    "run_id",
    "owner",
    "fencing_token",
    "acquired_at",
    "ttl_seconds",
    "released"
  ],
  "additionalProperties": false,
  "properties": {
    "schema_version": {
      "type": "string",
      "pattern": "^1\\.\\d+\\.\\d+$"
    },
    "run_id": {
      "type": "string",
      "pattern": "^\\d{4}-\\d{2}-\\d{2}-[a-z0-9]+(-[a-z0-9]+)*-[0-9a-f]{8}$"
    },
    "owner": {
      "type": "object",
      "required": [
        "principal_id",
        "harness",
        "session_ref"
      ],
      "additionalProperties": false,
      "properties": {
        "principal_id": {
          "type": "string",
          "pattern": "^[a-z0-9]+([._-][a-z0-9]+)*$"
        },
        "harness": {
          "type": "string",
          "minLength": 1
        },
        "session_ref": {
          "type": "string",
          "minLength": 1
        }
      }
    },
    "fencing_token": {
      "type": "integer",
      "minimum": 1
    },
    "acquired_at": {
      "type": "string",
      "pattern": "^\\d{4}-\\d{2}-\\d{2}T\\d{2}:\\d{2}:\\d{2}(\\.\\d{1,9})?Z$"
    },
    "ttl_seconds": {
      "type": "integer",
      "minimum": 1
    },
    "released": {
      "type": "boolean"
    }
  }
}
